{
  "$schema": "https://json-schema.org/draft/2020-12/schema",
  "$id": "https://github.com/bigsmartben/spec-kit-preview/schemas/preview/contract.schema.json",
  "title": "Spec Kit Preview Extension Validation Contract",
  "type": "object",
  "additionalProperties": false,
  "required": [
    "schemaVersion",
    "extension",
    "schemas",
    "commands",
    "sharedCommandRequiredPhrases",
    "sharedCommandForbiddenPhrases",
    "templates",
    "docs",
    "catalogRequiredPhrases"
  ],
  "properties": {
    "schemaVersion": {
      "type": "string",
      "pattern": "^[0-9]+\\.[0-9]+\\.[0-9]+$"
    },
    "extension": {
      "type": "object",
      "additionalProperties": false,
      "required": ["id", "version", "repository"],
      "properties": {
        "id": { "type": "string" },
        "version": { "type": "string" },
        "repository": { "type": "string", "format": "uri" }
      }
    },
    "schemas": {
      "type": "array",
      "minItems": 1,
      "uniqueItems": true,
      "items": { "$ref": "#/$defs/schemaFile" }
    },
    "commands": {
      "type": "array",
      "minItems": 1,
      "uniqueItems": true,
      "items": { "$ref": "#/$defs/command" }
    },
    "sharedCommandRequiredPhrases": {
      "$ref": "#/$defs/stringList"
    },
    "sharedCommandForbiddenPhrases": {
      "$ref": "#/$defs/stringList"
    },
    "templates": {
      "type": "array",
      "minItems": 1,
      "uniqueItems": true,
      "items": { "$ref": "#/$defs/template" }
    },
    "docs": {
      "type": "object",
      "additionalProperties": false,
      "required": ["paths", "forbiddenPhrases"],
      "properties": {
        "paths": {
          "type": "array",
          "minItems": 1,
          "items": { "type": "string" }
        },
        "forbiddenPhrases": {
          "$ref": "#/$defs/stringList"
        }
      }
    },
    "catalogRequiredPhrases": {
      "$ref": "#/$defs/stringList"
    }
  },
  "$defs": {
    "schemaFile": {
      "type": "object",
      "additionalProperties": false,
      "required": ["path", "requiredPhrases"],
      "properties": {
        "path": { "type": "string" },
        "requiredPhrases": { "$ref": "#/$defs/stringList" }
      }
    },
    "command": {
      "type": "object",
      "additionalProperties": false,
      "required": [
        "name",
        "file",
        "target",
        "format",
        "fidelityParameter",
        "template",
        "requiredPhrases",
        "forbiddenPhrases"
      ],
      "properties": {
        "name": { "type": "string" },
        "file": { "type": "string" },
        "target": { "type": "string" },
        "format": { "enum": ["html"] },
        "fidelityParameter": { "enum": ["required"] },
        "template": { "type": "string" },
        "requiredPhrases": { "$ref": "#/$defs/stringList" },
        "forbiddenPhrases": { "$ref": "#/$defs/stringList" }
      }
    },
    "template": {
      "type": "object",
      "additionalProperties": false,
      "required": ["path", "format", "requiredPhrases"],
      "properties": {
        "path": { "type": "string" },
        "format": { "enum": ["html"] },
        "requiredPhrases": { "$ref": "#/$defs/stringList" }
      }
    },
    "stringList": {
      "type": "array",
      "items": { "type": "string" }
    }
  }
}
